{"id":"INV-GEI-GEN1-001","type":"investigation","title":"Genesis 1 Hydraulic Interpretation Evaluation","status":"active","version":"1.0.9","investigation_status":"in_progress","question_ids":["QST-GEI-GEN1-001"],"claim_ids":["CLM-GEI-GEN1-001"],"source_ids":["SRC-GEN-001","SRC-WTR-001"],"evidence_ids":["EVD-GEI-001"],"comparison_ids":["CMP-GEN-EGY-001","CMP-GEN-MES-001"],"interpretation_ids":["INT-GEI-001"],"hypothesis_ids":["HYP-GEI-001"],"counterevidence_ids":[],"alternative_explanation":"The observed correspondences may arise from metaphorical reading, common human experience with water, literary patterning, or retrospective analogy rather than historical hydraulic design intent.","test_plan":["Map each proposed GEI correspondence to the KJV text and its immediate context.","Separate linguistic observations from homophone or symbolic proposals.","Compare proposed functions with independently documented hydraulic technologies.","Search for counterexamples and alternative explanations.","Record results without upgrading hypothesis status merely because relationships exist."],"result_ids":["RES-GEI-GEN1-001"],"outcome_ids":["OUT-GEI-GEN1-001"],"notes":"This investigation is designed to permit support, challenge, rejection, or inconclusive findings."}